{
  "schema_version": "1",
  "language": ["hi-IN", "en-IN"],
  "persona": {
    "name": "Asha",
    "prompt": "You are Asha, the front-desk assistant for {clinic_name}. Speak politely in the caller's language (Hindi, English or Hinglish). Keep replies short: one or two sentences. Never give medical advice."
  },
  "variables": [
    { "name": "clinic_name", "required": true, "description": "Clinic display name" },
    { "name": "patient_name", "default": "", "description": "Patient name if known" }
  ],
  "greeting": "Namaste {patient_name}, main {clinic_name} se Asha bol rahi hoon. Aapki kya madad kar sakti hoon?",
  "flow": {
    "initial_state": "identify_need",
    "states": [
      {
        "id": "identify_need",
        "task_prompt": "Find out whether the caller wants to book, reschedule or cancel an appointment, or has another question.",
        "next": ["book", "reschedule"]
      },
      {
        "id": "book",
        "task_prompt": "Collect preferred date and time, check availability, offer up to three slots, confirm one, then read back the booking.",
        "tools": ["check_slots", "book_slot", "lookup_patient", "end_call"],
        "next": ["identify_need"]
      },
      {
        "id": "reschedule",
        "task_prompt": "Find the existing appointment, offer new slots and confirm the change.",
        "tools": ["lookup_patient", "check_slots", "reschedule_slot", "end_call"],
        "next": ["identify_need"]
      }
    ]
  },
  "voice": {
    "preset": "india-standard",
    "tts": { "provider": "sarvam:anushka", "fallback": ["cartesia:hi-female-1"] }
  },
  "tools": [
    {
      "type": "calendar",
      "name": "check_slots",
      "description": "Check free appointment slots for a date.",
      "integration_id": "6f1c2b9e-4a5d-4c3b-9e8f-1a2b3c4d5e6f",
      "action": "check_slots",
      "filler_line": "Ek second, main slots check karti hoon."
    },
    {
      "type": "calendar",
      "name": "book_slot",
      "description": "Book a confirmed slot for the patient.",
      "integration_id": "6f1c2b9e-4a5d-4c3b-9e8f-1a2b3c4d5e6f",
      "action": "book"
    },
    {
      "type": "calendar",
      "name": "reschedule_slot",
      "description": "Move an existing appointment to a new slot.",
      "integration_id": "6f1c2b9e-4a5d-4c3b-9e8f-1a2b3c4d5e6f",
      "action": "reschedule"
    },
    {
      "type": "http",
      "name": "lookup_patient",
      "description": "Look up a patient record by phone number.",
      "url": "https://clinic.example.com/api/patients/lookup",
      "method": "POST",
      "parameters": {
        "type": "object",
        "properties": { "phone": { "type": "string" } },
        "required": ["phone"]
      },
      "auth": { "integration_id": "0b7d6c5a-1e2f-4a3b-8c9d-0e1f2a3b4c5d" },
      "timeout_ms": 3000
    },
    {
      "type": "end_call",
      "name": "end_call",
      "description": "End the call after the caller's request is handled or they say goodbye."
    }
  ],
  "extraction_fields": [
    "a3e1d2c4-5b6a-4f7e-8d9c-0b1a2c3d4e5f",
    "b4f2e3d5-6c7b-4a8f-9e0d-1c2b3d4e5f6a"
  ],
  "transfer": {
    "number": "+919800000000",
    "when": "caller asks for a human, a doctor, or describes an emergency",
    "mode": "warm"
  },
  "turn": { "allow_barge_in": true, "end_of_turn_ms": 250 },
  "recording": {
    "enabled": true,
    "disclosure_line": "Yeh call quality ke liye record ki ja rahi hai."
  },
  "limits": { "max_call_seconds": 600, "silence_timeout_s": 8 }
}
